{
  "schema_version": 1,
  "kind": "macomrade_message_catalog",
  "locale": "ja",
  "messages": {
    "role.base.description": "共通 Core アプリケーションとポータブルなポリシーです。",
    "role.compact.description": "ローカル容量が 512 GB 未満の容量制約 Mac です。",
    "role.expanded.description": "ローカル容量が 512 GB 以上の Mac です。",
    "role.developer.description": "共通 Core に加えて明示的に選択する開発ツールです。",
    "role.robotics.description": "developer ロールを継承するロボティクス開発ツールです。",
    "role.content.description": "クリエイティブな音声、動画、デザイン用アプリケーションです。",
    "role.gaming.description": "任意のゲームおよび学習用アプリケーションです。",
    "role.selected": "選択されたロール: {roles}",
    "adapter.inspect.summary": "確認したアダプター: {adapter}",
    "adapter.wechat.name": "WeChat ストレージライフサイクル",
    "adapter.wechat.summary": "メタデータのみでストレージを分類し、公式クリーンアップ画面へ引き継ぎます。",
    "adapter.wechat.class.message_database": "メッセージデータベースは保護対象であり、内容の検査や削除はしません。",
    "adapter.wechat.class.attachments": "添付ファイルとダウンロード済みメディアは、人による明示的な確認が必要です。",
    "adapter.wechat.class.cache": "サムネイルとキャッシュは、WeChat が対応する画面からのみクリーンアップできます。",
    "adapter.wechat.class.unknown": "ログと不明なコンテナデータは手動確認対象です。",
    "adapter.wechat.operation.official_cleanup": "WeChat の対応済みストレージ管理画面を開き、提案されたクリーンアップを確認します。",
    "adapter.claude_vm.name": "Claude VM ライフサイクル",
    "adapter.claude_vm.summary": "Claude のローカルエージェント VM を検査し、破壊的操作は既存の厳密な確認トランザクションへ委譲します。",
    "adapter.claude_vm.class.images": "VM イメージは Claude が再作成できますが、Cowork またはローカルエージェント実行を中断する可能性があります。",
    "adapter.claude_vm.class.bundle": "VM バンドル全体の削除は破壊的であり、セッション復旧は保証されません。",
    "adapter.claude_vm.operation.remove_images": "既存の厳密な確認トランザクションで VM イメージのみを削除します。",
    "adapter.claude_vm.operation.remove_bundle": "既存の厳密な確認トランザクションで VM バンドル全体を削除します。",
    "report.title": "macomrade 監査レポート",
    "report.status": "状態",
    "report.passed": "合格",
    "report.review_required": "要確認",
    "report.missing_core": "不足している Core アプリ",
    "report.source_mismatches": "入手元の不一致",
    "report.permission": "権限チェック",
    "report.preferences": "環境設定チェック",
    "report.next": "次の対応",
    "report.rerun": "JSON 証跡を確認し、指定された読み取り専用または明示的に承認済みの手順だけを実行してください。",
    "report.none": "なし",
    "report.count": "件数",
    "report.policy": "ポリシー: 読み取り専用レポートです。修復は実行していません。",
    "storage.scan.title": "ストレージスキャン",
    "storage.plan.title": "ストレージ回収計画",
    "storage.target": "空き容量目標: {bytes}",
    "storage.estimated": "推定回収可能量: {bytes}",
    "storage.staged": "ステージ済み・未回収: {bytes}",
    "storage.measured": "実測回収量: {bytes}",
    "storage.replan": "停止し、実測した空き容量から再計画してください。",
    "storage.weekly.deferred": "バッテリー残量が少ないため、週次スキャンを延期しました。",
    "storage.weekly.notify": "ストレージ確認が必要です。クリーンアップは実行していません。",
    "storage.protected": "記憶済みの判断により保護されています。",
    "storage.cloud.placeholder": "クラウド上の論理サイズは大きいですが、ローカル割り当てはすでに小さい状態です。",
    "storage.confirmation.required": "適用前にアクションクラスの正確な確認文を入力してください。",
    "browser.report.title": "macomrade ブラウザー監査レポート",
    "browser.stage": "ワークフロー段階",
    "browser.stage.scan": "スキャン",
    "browser.stage.review": "確認",
    "browser.stage.plan": "計画",
    "browser.stage.apply": "適用",
    "browser.stage.verify": "検証",
    "browser.stage.history": "履歴",
    "browser.status.passed": "合格",
    "browser.status.partial": "一部完了",
    "browser.status.preview": "プレビューのみ",
    "browser.status.written": "計画を記録済み",
    "browser.status.unchanged": "計画は記録済み",
    "browser.status.blocked": "安全に停止",
    "browser.status.failed": "失敗",
    "browser.status.unavailable": "利用不可",
    "browser.metric.bookmark_count": "ブックマーク",
    "browser.metric.reading_list_count": "リーディングリスト項目",
    "browser.metric.normalization_proposal_count": "正規化候補",
    "browser.metric.normalization_blocked_count": "停止した正規化",
    "browser.metric.duplicate_group_count": "重複グループ",
    "browser.metric.duplicate_item_count": "重複項目",
    "browser.metric.queued_count": "確認待ち",
    "browser.metric.suppressed_count": "記憶により抑制",
    "browser.metric.operation_count": "操作数",
    "browser.metric.planned_operation_count": "計画済み操作",
    "browser.metric.backup_verified": "エクスポート証跡の検証",
    "browser.metric.exact_rollback_supported": "完全ロールバック対応",
    "browser.metric.apply_interface": "Safari 適用インターフェース",
    "browser.metric.manual_handoff_only": "手動引き継ぎのみ",
    "browser.metric.verified_operation_count": "検証済み操作",
    "browser.metric.failed_operation_count": "失敗した操作",
    "browser.metric.custom_classification_count": "カスタム分類",
    "browser.metric.decision_count": "記憶済み判断",
    "browser.metric.active_decision_count": "有効な判断",
    "browser.value.true": "はい",
    "browser.value.false": "いいえ",
    "browser.value.unavailable": "利用不可",
    "browser.report.next": "次の指定段階へ進む前に、秘匿化済み JSON 証跡を確認してください。",
    "browser.report.policy": "ポリシー: このレポートは集計証跡のみを含み、ブラウザー書き込み権限を付与しません。"
  }
}
