{
  "schema_version": 1,
  "kind": "macomrade_message_catalog",
  "locale": "zh-Hans",
  "messages": {
    "role.base.description": "通用 Core 应用与可移植策略。",
    "role.compact.description": "本地存储小于 512 GB 的容量受限 Mac。",
    "role.expanded.description": "本地存储不低于 512 GB 的 Mac。",
    "role.developer.description": "在通用 Core 之外明确选择的开发工具。",
    "role.robotics.description": "继承 developer 角色的机器人开发工具。",
    "role.content.description": "创意音频、视频与设计应用。",
    "role.gaming.description": "可选的游戏与学习应用。",
    "role.selected": "已选择角色：{roles}",
    "adapter.inspect.summary": "已检查适配器：{adapter}",
    "adapter.wechat.name": "WeChat 存储生命周期",
    "adapter.wechat.summary": "仅通过元数据进行存储分类，并交接至官方清理界面。",
    "adapter.wechat.class.message_database": "消息数据库受保护，不读取内容也不删除。",
    "adapter.wechat.class.attachments": "附件与已下载媒体需要人工明确审查。",
    "adapter.wechat.class.cache": "缩略图与缓存只能通过 WeChat 支持的界面清理。",
    "adapter.wechat.class.unknown": "日志与未知容器数据均需人工审查。",
    "adapter.wechat.operation.official_cleanup": "打开 WeChat 支持的存储管理界面，并审查其建议的清理内容。",
    "adapter.claude_vm.name": "Claude VM 生命周期",
    "adapter.claude_vm.summary": "检查 Claude 本地 Agent VM 存储，并将破坏性动作委托给既有的精确确认事务。",
    "adapter.claude_vm.class.images": "Claude 可以重建 VM 镜像，但可能中断 Cowork 或本地 Agent 运行。",
    "adapter.claude_vm.class.bundle": "删除完整 VM bundle 属于破坏性操作，且不承诺恢复会话。",
    "adapter.claude_vm.operation.remove_images": "使用既有的精确确认事务仅删除 VM 镜像。",
    "adapter.claude_vm.operation.remove_bundle": "使用既有的精确确认事务删除完整 VM bundle。",
    "report.title": "macomrade 审计报告",
    "report.status": "状态",
    "report.passed": "通过",
    "report.review_required": "需要复核",
    "report.missing_core": "缺失的 Core 应用",
    "report.source_mismatches": "安装来源不一致",
    "report.permission": "权限检查",
    "report.preferences": "系统偏好检查",
    "report.next": "下一步",
    "report.rerun": "请审阅 JSON 证据，并且只执行指定的只读或已明确授权流程。",
    "report.none": "无",
    "report.count": "数量",
    "report.policy": "策略：这是只读报告；未执行任何修复。",
    "storage.scan.title": "存储扫描",
    "storage.plan.title": "存储释放计划",
    "storage.target": "剩余空间目标：{bytes}",
    "storage.estimated": "预计可释放：{bytes}",
    "storage.staged": "已暂存但未释放：{bytes}",
    "storage.measured": "实际已释放：{bytes}",
    "storage.replan": "立即停止，并根据新测得的剩余空间重新规划。",
    "storage.weekly.deferred": "因电量较低，已跳过本周扫描。",
    "storage.weekly.notify": "存储需要复核；未执行任何清理。",
    "storage.protected": "受已记忆决策保护。",
    "storage.cloud.placeholder": "云端逻辑大小较大，但本地实际分配已经很小。",
    "storage.confirmation.required": "执行前必须输入该动作类别的精确确认文本。",
    "browser.report.title": "macomrade 浏览器审计报告",
    "browser.stage": "工作流阶段",
    "browser.stage.scan": "扫描",
    "browser.stage.review": "复核",
    "browser.stage.plan": "计划",
    "browser.stage.apply": "执行",
    "browser.stage.verify": "验证",
    "browser.stage.history": "历史",
    "browser.status.passed": "通过",
    "browser.status.partial": "部分完成",
    "browser.status.preview": "仅预览",
    "browser.status.written": "计划已记录",
    "browser.status.unchanged": "计划已存在",
    "browser.status.blocked": "已安全阻止",
    "browser.status.failed": "失败",
    "browser.status.unavailable": "不可用",
    "browser.metric.bookmark_count": "书签数量",
    "browser.metric.reading_list_count": "阅读列表数量",
    "browser.metric.normalization_proposal_count": "规范化建议",
    "browser.metric.normalization_blocked_count": "已阻止的规范化",
    "browser.metric.duplicate_group_count": "重复组数量",
    "browser.metric.duplicate_item_count": "重复项目数量",
    "browser.metric.queued_count": "待复核数量",
    "browser.metric.suppressed_count": "被记忆抑制数量",
    "browser.metric.operation_count": "操作数量",
    "browser.metric.planned_operation_count": "计划操作",
    "browser.metric.backup_verified": "导出证据已验证",
    "browser.metric.exact_rollback_supported": "支持精确回滚",
    "browser.metric.apply_interface": "Safari 执行接口",
    "browser.metric.manual_handoff_only": "仅限手动交接",
    "browser.metric.verified_operation_count": "已验证操作",
    "browser.metric.failed_operation_count": "失败操作",
    "browser.metric.custom_classification_count": "自定义分类",
    "browser.metric.decision_count": "已记忆决策",
    "browser.metric.active_decision_count": "有效决策",
    "browser.value.true": "是",
    "browser.value.false": "否",
    "browser.value.unavailable": "不可用",
    "browser.report.next": "进入下一个指定阶段前，请先审阅脱敏 JSON 证据。",
    "browser.report.policy": "策略：本报告只包含汇总证据，不授予任何浏览器写入权限。"
  }
}
