{
  "schema_version": 1,
  "kind": "macomrade_message_catalog",
  "locale": "en",
  "messages": {
    "role.base.description": "Universal Core applications and portable policy.",
    "role.compact.description": "Capacity-constrained Mac under 512 GB.",
    "role.expanded.description": "Mac with 512 GB or more local storage.",
    "role.developer.description": "Developer tools selected explicitly beyond the universal Core.",
    "role.robotics.description": "Robotics development tools, inheriting the developer role.",
    "role.content.description": "Creative audio, video, and design applications.",
    "role.gaming.description": "Optional gaming and learning applications.",
    "role.selected": "Selected roles: {roles}",
    "adapter.inspect.summary": "Inspected adapter: {adapter}",
    "adapter.wechat.name": "WeChat storage lifecycle",
    "adapter.wechat.summary": "Metadata-only storage classification with an official-cleanup handoff.",
    "adapter.wechat.class.message_database": "Message databases are protected and never inspected for content or deleted.",
    "adapter.wechat.class.attachments": "Attachments and downloaded media require explicit human review.",
    "adapter.wechat.class.cache": "Thumbnails and caches may only be cleaned through a supported WeChat interface.",
    "adapter.wechat.class.unknown": "Logs and unknown container data remain manual-review items.",
    "adapter.wechat.operation.official_cleanup": "Open WeChat's supported storage-management interface and review its proposed cleanup.",
    "adapter.claude_vm.name": "Claude VM lifecycle",
    "adapter.claude_vm.summary": "Inspects Claude local-agent VM storage and delegates destructive actions to existing exact-confirmation transactions.",
    "adapter.claude_vm.class.images": "VM images can be rebuilt by Claude but may interrupt Cowork/local-agent execution.",
    "adapter.claude_vm.class.bundle": "The complete VM bundle is destructive to remove and has no session-recovery promise.",
    "adapter.claude_vm.operation.remove_images": "Use the existing exact-confirmation transaction to remove only VM images.",
    "adapter.claude_vm.operation.remove_bundle": "Use the existing exact-confirmation transaction to remove the complete VM bundle.",
    "report.title": "macomrade audit report",
    "report.status": "Status",
    "report.passed": "Passed",
    "report.review_required": "Review required",
    "report.missing_core": "Missing Core apps",
    "report.source_mismatches": "Source mismatches",
    "report.permission": "Permission checks",
    "report.preferences": "Preference checks",
    "report.next": "Next action",
    "report.rerun": "Review the JSON evidence and run only the named read-only or explicitly authorized workflow.",
    "report.none": "None",
    "report.count": "Count",
    "report.policy": "Policy: read-only report; no repair was attempted.",
    "storage.scan.title": "Storage scan",
    "storage.plan.title": "Storage reclaim plan",
    "storage.target": "Free-space target: {bytes}",
    "storage.estimated": "Estimated reclaimable: {bytes}",
    "storage.staged": "Staged, not reclaimed: {bytes}",
    "storage.measured": "Measured reclaimed: {bytes}",
    "storage.replan": "Stop and replan from newly measured free space.",
    "storage.weekly.deferred": "Weekly scan deferred because battery power is low.",
    "storage.weekly.notify": "Storage review is due; no cleanup was attempted.",
    "storage.protected": "Protected by a remembered decision.",
    "storage.cloud.placeholder": "Cloud logical size is large, but local allocation is already small.",
    "storage.confirmation.required": "Enter the exact action-class confirmation before applying."
  }
}
